{
	"schema_version": 1,
	"id": "npc_hunter_brannoch",
	"display_name": "Cacador Brannoch [PLACEHOLDER]",
	"display_name_key": "npc.npc_hunter_brannoch.name",
	"region": "greenwood",
	"dialogue_id": "dlg_hunter_brannoch",
	"interact_radius": 3.5,
	"position": [21.0, 0.0, 3.0],
	"placeholder": false
}
